,date,text,topic,topic_proba
1256030,1684563029,"Вчера ФСБ провела обыски у активистов и общественников по уголовному делу против двух бывших сотрудников Пермского «Мемориала» (организация ликвидирована в 2022 году, входила в структуру международного «Мемориала», признанного иностранным агентом и тоже ликвидированного). Появилось видео с обысков: оперативники пришли домой к свидетелям.

Обыски прошли у двух членов Совета по правам человека при президенте РФ — Светланы Маковецкой (руководителя центра ГРАНИ) и Татьяны Марголиной (экс-омбудсмена Пермского края), журналиста Татьяны Черепановой и журналистки, экс-члена краевой общественной наблюдательной комиссии по правам осужденных Оксаны Асауленко, правозащитника Игоря Аверкиева, члена краевой Общественной палаты Надежды Агишевой, юристов Сергея Трутнева и Сергея Максимова, члена правления пермского «Мемориала» Веры Седининой.

На кадрах видно, как людям в камуфляже открывает дверь муж Татьяны Марголиной.

— Не переживайте, мы на минуту. Следственные действия. Постановление суда, будет проведен обыск у вас, ознакомьтесь, — говорят ему.

Также у мужчины спросили, известно ли ему, что в квартире хранятся документы, связанные с обществом «Мемориал»*. Он ответил, что не знает.

Во второй части ролика спецназ МВД взламывает дверь в дом, где живет семья Надежды Агишевой. По ходу ролика у ее супруга спрашивают, почему им не открывали.",Силовые структуры,0.9755005
1256027,1684562744,"Ровно 44 года назад Пермь стала городом-миллионником. 20 мая 1979 года родились миллионные жители Перми. Ими признали сразу трех младенцев: Алешу Алалыкина, Васю Маланухина и Любу Пономареву.

1 июня прошла торжественная регистрация рождения миллионных малышей. Их семьи вне очереди получили от города по квартире.

Публикуем архивные фото с праздника.

https://59.ru/text/gorod/2023/05/20/72316940/?utm_source=vk&utm_medium=social&utm_campaign=59",Город,0.4921624
1256026,1684562729,"На холмиках, напоминающих могилы, которые обнаружили на берегу Камы в Нижней Курье, оказались реальные фото умерших людей. В редакцию обратилась мать одного из них. 
 
— На одном из фото изображен мой сын, который умер 17 лет назад. Памятник заказывали в мастерской у Северного кладбища 16 лет назад. Были на кладбище 15 мая, там всё в порядке, — рассказала пермячка Ольга. 
 
Сын Ольги похоронен на Верхне-Курьинском кладбище, а памятник ему изготавливали в мастерской на улице Красноборской. К сожалению, точный адрес женщина не запомнила, контактов у нее не сохранилось. 
 
Здесь фото остальных портретов, найденных в Верхней Курье. Если на них изображены ваши родственники, напишите, пожалуйста, нам в сообщениях сообщества.
 
Также мы будем рады любой информации о мастерской, в которой изготовили эти фото и об обстоятельствах их попадания на берег Камы.",Культура,0.4570156
1256025,1684562600,"Юле 22 года. Она живет в провинции Барселоны: девушка выросла в Испании, куда ее после удочерения привезли приемные родители. Тогда в России она оставила брата Диму и сестру Машу, которых пыталась отыскать несколько лет. 

Помогли социальные сети: брата Юля нашла через «ВКонтакте». А вот куда уехала с новыми родителями сестра, узнать не получается из-за тайны усыновления. 

Удивительную историю, в которой родная кровь оказывается сильнее расстояний, рассказывают наши коллеги.  

https://59.ru/text/family/2023/05/20/72319886/?utm_source=vk&utm_medium=social&utm_campaign=59",Культура,0.706679
1256013,1684559211,"Проявляя заботу о внешности, мы часто забываем, что она — отражение внутреннего состояния организма и органов. И печень как раз в числе индикаторов, поэтому поддерживать ее работоспособность крайне важно. 

Но в нашем холодильнике постоянно есть продукты, которые «убивают» клетки печени или просто мешают им работать, как надо. 

Что исключить из рациона и почему — объясняют врачи. 

https://59.ru/text/food/2023/05/20/72320495/?utm_source=vk&utm_medium=social&utm_campaign=59",Наука и техника,0.45263457
1256011,1684559066,"Публикуем подборку интересных видеороликов прошедшей недели. В нее вошли воры из Тамбова, которые забрали из торгового центра целый банкомат с пятью миллионами рублей. А еще природа настолько очистилась, что рыбаки-дальневосточники вместо рыбы добывают десятки литров японского виски.

https://59.ru/text/world/2023/05/20/72322148/?utm_source=vk&utm_medium=social&utm_campaign=59",Экономика,0.37947953
1256010,1684558801,"Совершить покупку в ТЦ «Семь Пятниц» = выиграть прогулку на яхте. 
 
[https://vk.com/7fridaysperm|Торговый центр «Семь Пятниц»] и [https://vk.com/yahtaclub|парусный клуб «Шкипер»] разыгрывают среди покупателей ТЦ сертификат на прогулку на парусной яхте в заливе для пяти человек продолжительностью 6 часов. Сертификат действует до 31.08.23. 
 
Принять участие очень просто: 
• с 15 мая по 20 июля, до 11:30 2023 г. нужно совершить покупку от 1000 руб.;
• заполнить купон* для розыгрыша; 
• купон необходимо бросить в ящик на 4-м этаже ТЦ.

Итоги подведут 20 июля в прямом эфире.
*Купон для розыгрыша выдается продавцом отдела, в котором приобретается товар/услуга. 
 
Информацию об организаторе акции, сроках, правилах её проведения, количестве призов, сроках, месте и порядке их получения узнавайте [https://vk.com/docs-87336175|по ссылке].
Важно: чек должен быть сохранен. 
 
Попутного ветра и легких покупок!
#торговыйцентр7пятниць #лёгкиепокупки #конкурспермь #розыгрышпермь

ООО «Центр-Про»
https://7-fridays.ru/?erid=Kra23Vj6Z",Город,0.48116878
1256009,1684558670,"Илья — врач-эндоскопист, который может буквально заглянуть вам внутрь благодаря специальным приборам. А потом — корректно рассказать о диагнозе и ответить на самые неудобные вопросы. 

Вот только даже с таким подходом он часто слышит в свой адрес очень неприятные вещи. А еще Илью и его коллег по цеху выводят из себя умники, вруны и спорщики. 

Публикуем топ-5 самых раздражающих для врача вещей. Надеемся, вы здесь себя не узнали. 

https://59.ru/text/job/2023/05/20/72318566/?utm_source=vk&utm_medium=social&utm_campaign=59",Наука и техника,0.8278388
1256007,1684558479,"В Белгороде во двор многоэтажки упал беспилотник, движение грузового транспорта по Крымскому мосту временно не будут запускать из-за провокаций, генпрокуратура признала нежелательной деятельность фонда Greenpeace в России.

Рассказываем об этих и других последних новостях вокруг СВО. 

https://59.ru/text/world/2023/05/19/72318272/?utm_source=vk&utm_medium=social&utm_campaign=59",Силовые структуры,0.82759106
1256005,1684557381,"Проснулись и задаетесь вопросом «куда пойти в выходные»? Загляните в нашу афишу! 

В ближайшие два дня будут фестивали моноспектаклей и пермской кухни, ледовое шоу Ильи Авербуха со звездами фигурного катания. В программе Ночи музеев много интересного, а еще с гастролями в Перми сейчас два театра.

https://59.ru/text/entertainment/2023/05/20/72315638/?utm_source=vk&utm_medium=social&utm_campaign=59",Культура,0.51966804
1256004,1684557140,"Подростков, которые пропали в поселке Кукуштан, нашли. Их искали с 17 мая. 

https://59.ru/text/incidents/2023/05/20/72322268/?utm_source=vk&utm_medium=social&utm_campaign=59",Силовые структуры,0.9158886
1256001,1684555200,"Сезон ремонта в Перми официально открыт, а все потому, что до лета остаются считанные деньки. Если вы сейчас в поиске опытных специалистов и проверенных компаний, то в материале поделились контактами. 
 
Переходите по ссылке, чтобы воплотить задуманное в жизнь
https://59.ru/text/longread/2023/03/27/72160649/",Город,0.78149825
1255928,1684514040,"Когда маленькая Варя заинтересовалась музыкой, ее увлечение поддержал старший брат Егор. С тех пор с нотами и песнями не расстаются оба. Когда они подросли, появилось свое семейное дело — группа UBEL. 

А недавно Варе удалось победить на шоу «Ну-ка вместе!» на телеканале «Россия», где равнодушным к ее вокальным данным не остались даже Любовь Успенская, Николай Басков и Сергей Лазарев. 

О том, как музыка превратилась в неотъемлемую часть жизни, которая чуть не оборвалась в 2021 году, Варвара рассказывает в этом небольшом видеоинтервью.",Культура,0.67726517
1255912,1684511415,"В центре Перми загорелось заброшенное здание. Публикуем фото и видео с места событий.

https://59.ru/text/incidents/2023/05/19/72321461/?utm_source=vk&utm_medium=social&utm_campaign=59",Культура,0.64303267
1255903,1684508935,"22 мая в Перми появится новая остановка городских электричек. Ее откроют у комплекса ПНИПУ.

https://59.ru/text/transport/2023/05/19/72304481/?utm_source=vk&utm_medium=social&utm_campaign=59",Город,0.57310164
1255902,1684508846,"Помните, мы недавно рассказывали о холмиках-могилках на берегу Камы в Нижней Курье? На них оказались портреты реальных людей. Один из них — молодой человек, умерший 17 лет назад. Перейдите по ссылке, чтобы рассмотреть все снимки, вдруг среди них окажется ваш знакомый.

https://59.ru/text/gorod/2023/05/19/72321302/?utm_source=vk&utm_medium=social&utm_campaign=59",Культура,0.47408023
1255901,1684508820,"Уже с понедельника, 22 мая, следующая по кольцевому маршруту электричка будет трижды в день останавливаться возле студгородка ПНИПУ. 

Публикуем новое расписание кольцевой электрички и рассказываем когда поезд будет останавливаться на платформе «Комплекс ППИ» и в обратном направлении.

https://59.ru/text/transport/2023/05/19/72304481/?utm_source=vk&utm_medium=social&utm_campaign=59",Город,0.9385035
1255898,1684508404,"Только в течение двух недель пермяки могут увидеть удивительные костюмы из нашумевшего телепроекта «Маска». С 19 мая по 4 июня «маски», созданные для разных сезонов шоу, будут ждать горожан в ТРЦ «iMall ЭСПЛАНАДА» (0+). Рассмотреть и даже сфотографироваться можно совершенно бесплатно.
https://59.ru/text/entertainment/2023/05/19/72319673/

Реклама
ООО «ПРОСПЕКТ ПЕРМЬ»
https://59.ru/?erid=Kra24BMr1",Культура,0.7472347
1255890,1684507259,"Один из пермских Telegram-каналов раскритиковал пермскую школу №12. Говорят, там не проводят «Разговоры о важном» с участием бойцов СВО и не собирают помощь Донбассу. В общем, «втыкают палки в колеса» патриотическому воспитанию. Мы спросили у администрации Перми должна ли школа организовывать такие мероприятия.

https://59.ru/text/education/2023/05/19/72321230/?utm_source=vk&utm_medium=social&utm_campaign=59",Спорт,0.86492676
1255875,1684504869,"❗В Белгороде во двор многоэтажки упал беспилотник. 
По словам главы региона Вячеслава Гладкова, он ударился в окно квартиры на седьмом этаже. 
 
— Пострадавших и разрушений нет. На месте работают взрывотехники и оперативная группа, — написал Гладков.",Силовые структуры,0.95018744
1255874,1684504803,"Теплый воздух обдувает волосы, от воды веет свежестью, а все негативные мысли улетучиваются моментально. 
 
Организовать себе такой отдых можно на теплоходе или прогулочных трамвайчиках по Каме. «Кама-Трэвел» делает тематические рейсы, дискотеки, вечера с живой музыкой, развлекательные программы для детей и даже экскурсы в историю Перми. 
 
В материале рассказываем, какие бывают рейсы и сколько они стоят.
https://59.ru/text/gorod/2023/05/19/72318971/

Реклама
ООО «Кама-Трэвел»
https://59.ru/?erid=Kra23h9Po",Город,0.64335763
1255871,1684504463,"Если часто ездите около ДКЖ, у нас для вас не самая веселая новость: в этом районе на все лето перекроют движение на пересечении двух улиц.

https://59.ru/text/transport/2023/05/19/72320405/?utm_source=vk&utm_medium=social&utm_campaign=59",Город,0.6870366
1255863,1684502610,"Вашему вниманию — Жасмин Ларсен и ее огненно-рыжие волосы, длина которых совсем немного не доходит до 150 сантиметров. Последний раз современная Рапунцель стригла волосы в 2017 году!

Девушка признается, что привлекает своей внешностью большое количество богатых мужчин. Среди очарованных красотой — шейхи, миллиардеры и даже влиятельные политики.

Наши коллеги показывают, как выглядит реальная Рапунцель, и рассказывают о жизни и необычных предложениях, которые поступали Жасмин.

https://59.ru/text/style/2023/05/19/72316076/?utm_source=vk&utm_medium=social&utm_campaign=59",Культура,0.9227632
1255847,1684501303,"Евгений Ройзман* давно стал известен за пределами Екатеринбурга. В столице Урала он успел побыть мэром, открыть музей Невьянской иконы и создать традицию утренних пробежек, после которых обязательно звал желающих пить чай с пирогами. 
 
В марте к Евгению Вадимовичу* пришли полицейские из-за поста в соцсети — там обнаружили дискредитацию ВС РФ. Его уже штрафовали за это, и на этот раз предъявили уголовное обвинение. 
 
В суде за Ройзмана* вступились Алла Пугачева, вдова первого президента России Наина Ельцина, драматург Николай Коляда и многие другие известные деятели — они передали адвокату свои характеристики политика. 
 
Какое решение вынес екатеринбургский суд — смотрите в этом видео. 

*Признан иноагентом в РФ.",Культура,0.9794333
1255842,1684500327,"Президент Федерации футбола Пермского края Дмитрий Терехов подал в отставку 
 
Об этом изданию Properm рассказали сразу несколько источников, в том числе член исполкома федерации футбола Виктор Барсуков. Подтвердить информацию у самого Терехова не удалось — он не ответил на телефонный звонок. 
 
По информации издания, причиной увольнения стало уголовное дело, которое в 2021 году возбудили из-за предоставления поддельных результатов ПЦР-тестов на коронавирус. Они предназначались для спортсменов краевой федерации и нужны были для проведения матча в манеже «Пермь Великая». Был заключен фиктивный договор на тестирование между этой федерацией и другой организацией.",Спорт,0.84238136
1255832,1684498931,"Сдавая анализы, мы ориентируемся на нормальные показатели в бланке: если полученные цифры вписываются, можно не переживать.

Но что делать, если показатели выше или ниже? Стоит ли паниковать? Как вообще правильно смотреть на результаты анализов?

Все эти вопросы мы задали врачу-терапевту, публикуем его ответы.

https://59.ru/text/health/2023/05/19/72316652/?utm_source=vk&utm_medium=social&utm_campaign=59",Наука и техника,0.5265056
1255821,1684497199,"Пермские студенты возмущены увольнением руководителя IT-института при ПГНИУ

Как пишут в паблике PSU Community, вместо уважаемого преподавателя, который «поставил на ноги IT-институт», назначили экс-заведующего научно-исследовательской лабораторией в Москве, даже не имеющего ученой степени.

Студенты боятся, что кадровые изменения приведут к ухудшению дел в IT-институте. Мы постарались разобраться в ситуации.

https://59.ru/text/education/2023/05/19/72319595/?utm_source=vk&utm_medium=social&utm_campaign=59",Культура,0.677669
1255816,1684496640,"Продуктовые супермаркеты — это магазины, которые нужны чаще всего. Мы заходим в них после работы, чтобы купить что-нибудь к ужину, наведываемся в выходные, чтобы купить продуктов на неделю, и забегаем за чем-нибудь срочно понадобившимся в любое время.

А какими должен быть хороший супермаркет? 

Сегодня мы спросили об этом пермяков, и они рассказали, что их бесит в супермаркетах и какими они хотят их видеть.

https://59.ru/text/gorod/2023/05/19/72316154/?utm_source=vk&utm_medium=social&utm_campaign=59",Экономика,0.8194944
1255815,1684496152,"❗️Срок ремонта площади с платной парковкой перед вокзалом Пермь II продлили 
 
К 20 мая планировали закончить, но рабочие не успевают. Работы там будут выполнять до конца месяца. 
 
Бесплатная парковка по прежнему остается доступной без каких-либо ограничений. 
 
Пермяки, планируйте прибытие на вокзал заблаговременно. И поделитесь информацией с теми, кому она будет полезна!",Город,0.9970125
