,date,text,topic,topic_proba
1255616,1684472707,"Как думаете, сколько в среднем зарабатывают руководители учреждений культуры в Прикамье? 

Что ж, директора театра и музея в Прикамье с зарплатой меньше ста тысяч вы вряд ли найдёте. В среднем они получают не меньше 200 тысяч рублей, но и тут всё зависит от учреждения. Самый высокий показатель — у худрука Театра-Театра Бориса Мильграма. Его среднемесячный заработок превысил 707 тысяч рублей.

Данные о зарплатах руководителей учреждений культуры Прикамья опубликовал Минкульт.

https://59.ru/text/culture/2023/05/19/72315710/?utm_source=vk&utm_medium=social&utm_campaign=59",Культура,0.9868978
1255599,1684470631,"Главные события вокруг СВО за прошедшие сутки:

▪️В Россию могут прийти индийские бренды одежды категории fashion, а также  арабский аналог IKEA.

▪️Москва и Киев согласились обсудить перемирие при посредниках.

▪️Прокурор попросил назначить экс-мэру Екатеринбурга штраф за дискредитацию ВС РФ.

▪️На Бориса Гребенщикова составили протокол о дискредитации ВС РФ.

Об этих и других новостях более подробно читайте в этой подборке:

https://59.ru/text/world/2023/05/18/72317057/?utm_source=vk&utm_medium=social&utm_campaign=59",Силовые структуры,0.4931084
1255566,1684432852,"Недалеко от ТЭЦ-6 автобус сбил пенсионера. По предварительным данным, мужчина перебегал дорогу в неположенном месте.

https://59.ru/text/incidents/2023/05/18/72317177/?utm_source=vk&utm_medium=social&utm_campaign=59",Силовые структуры,0.4038897
1255565,1684432432,"В Перми проходит Форум гостеприимства, который посвящен туризму. На нем открыли ярмарку, где мастера со всей страны показывают (и продают) сувениры и разнообразные, в том числе национальные, угощения.

https://59.ru/text/business/2023/05/18/72317042/?utm_source=vk&utm_medium=social&utm_campaign=59",Город,0.2629449
1255545,1684428480,"Из роддома выписали две тройни за раз!

Наши коллеги побывали на выписке и посмотрели, как счастливые папы встречали жен и забирали на трясущихся коленках своих малышей. Семьи Обмоиных и Сафроновых рассказали, с какими трудностями столкнулись и каково это — узнать, что у вас будет тройня.

Посмотрите это трогательное видео, оно точно заставит вас улыбнуться.",Культура,0.3772795
1255535,1684424314,"Если вы уже достали шорты, то отложите их на время  — в ближайшие дни ожидаются заморозки. К счастью, они будут только по ночью и утрам. Но все равно, не жарко. 

https://59.ru/text/spring/2023/05/18/72316817/?utm_source=vk&utm_medium=social&utm_campaign=59",Наука и техника,0.94840276
1255532,1684421754,"В пермском УФАС назвали сообщение пермской кофейни о грудном молоке обычной «информацией о предлагаемых товарах», не увидев в нем нарушений.

https://59.ru/text/business/2023/05/18/72316595/?utm_source=vk&utm_medium=social&utm_campaign=59",Экономика,0.9859745
1255528,1684421464,"Исследователи провели первое в истории полноразмерное цифровое сканирование «Титаника», который больше ста лет лежит на дне Атлантического океана. Таким лайнер еще никто никогда не видел.

https://59.ru/text/world/2023/05/18/72315551/?utm_source=vk&utm_medium=social&utm_campaign=59",Наука и техника,0.8390128
1255512,1684417680,"30 лет назад в Нижнем Тагиле разбился спортивный самолет Як-52. Он рухнул на толпу зрителей, которые пришли посмотреть праздничное авиашоу 9 Мая.

— Картина была страшная. «Як» лежал посреди Театральной площади, в нем останки летчика, — вспоминает историк Сергей Пудовкин.

В тот день погибли 19 человек, в том числе два члена экипажа, 37 человек получили травмы, многие пострадавшие на всю жизнь остались инвалидами.

В этом видео наши коллеги вспоминают детали авиакатастрофы.",Культура,0.6659279
1255511,1684417635,"⚡️Удалось установить личность пилота штурмовика Ил-2, который подняли со дна Черного моря пермские дайверы 
 
В прошлом году наши земляки были в экспедиции на Черном море в районе Керчи. На глубине 10–11 метров в Геленджикском заливе они нашли утонувший советский Ил-2 и частями подняли его наверх. Штурмовик хорошо сохранился и в Перми планируют после восстановления установить его как памятник. 
 
В кабине утонувшего штурмовика нашли остатки кителя, штанов и планшетку (с картой) летчика. Пока в Перми идут реставрационные работы, через архивы установили личность летчика. 
 
Им был младший сержант Андрей Васильевич Саломатин. Он родился в 1918 году в селе Новоселово Ельнинского района Смоленской области. Был призван в 1943 году. Служил в военно-воздушных силах Черноморского флота. Погиб 6 мая 1943 года. 
 
— Возможно, останки советского летчика находятся рядом с Ил-2. Когда они будут обнаружены, мы поднимем вопрос о перезахоронении летчика, — сообщил руководитель поисковых экспедиций и водолазных работ Центра подводных исследований Прикамья Денис Михалев. 
 
Фото: Центр подводных исследований Прикамья",Силовые структуры,0.63227564
1255503,1684415381,"Лето — лучшее время, чтобы попробовать оттенки лака, на которые вы не решались.

Наши коллеги собрали 13 идей маникюра, который будет в моде этим летом. Цвета от ярко-красного до насыщенного лавандового — вы точно захотите какой-нибудь из них!

https://59.ru/text/style/2023/05/18/72313007/?utm_source=vk&utm_medium=social&utm_campaign=59",Экономика,0.84721243
1255502,1684415232,"Кофе с грудным молоком: шутка или нет? 🤔

Новость о том, что в Перми предприниматель продает кофе на грудном молоке, недавно облетела Сеть.

Люди задавались вопросами этичности и безопасности такого напитка, а владелец кофеен говорил про питательность и особенный вкус.

Но после того как Роспотребнадзор начал проверку, предприниматель заявил, что это была всего лишь шутка, вышедшая из-под контроля.

▶️  С чего началась эта громкая история и другие подробности — в видео.",Экономика,0.8933478
1255493,1684412570,"«Последней каплей стало то, во что превратился Новосибирск, который строил в том числе и мой дед».

Виктория Шелкунова три недели назад кардинально поменяла свою жизнь. Девушка собрала вещи, взяла мужа и двух мопсов и навсегда перебралась жить в Таиланд.

До этого Виктория часто бывала в азиатских странах, возможно, поэтому многие сложности ее и не смущают.

Девушка рассказала нашим коллегам всё о переезде и тайской жизни. Почитайте, почему Виктория избегает туристических мест и как таец легко выведет любого европейца из себя.

https://59.ru/text/world/2023/05/18/72313325/?utm_source=vk&utm_medium=social&utm_campaign=59",Культура,0.500301
1255490,1684412434,"Недавно мы рассказывали непростую историю пермячки Ульяны. По словам девушки её бывший муж и свекровь вынудили ее совершить фиктивную сделку по продаже квартиры, не заплатили денег и фактически оставили с двумя детьми без жилья.

Также пермячка заявляла о жутких издевательствах над ней и сыновьями: муж бил и унижал их, дело доходило даже до окунаний головой в унитаз.

Прокуратура призвала полицию провести проверку законности действий бывших мужа и свекрови пермячки.

https://59.ru/text/criminal/2023/05/18/72315167/?utm_source=vk&utm_medium=social&utm_campaign=59",Культура,0.49698502
1255485,1684411247,"Когда леопардик Мао появился в Иркутской зоогалерее, он был крохотным, диким и едва живым. Но опеку над ним взяли опытные ветеринары и недавно родившая собака Мира. 
 
Маленький Мао рос вместе с щенками Миры, они согревали котенка по ночам и играли с ним. Когда Мао вырос, его попробовали отселить от собак, но леопард слишком грустил, поэтому теперь их с братьями не разлучают. 
 
Посмотрите милое видео про красавца Мао! 🥰",Наука и техника,0.96651256
1255477,1684408904,"— Считать одни продукты плохими, а другие — хорошими, неправильно. Чем старательнее мы запрещаем себе «вредную» еду, тем больше ее хотим, — говорит врач-гастроэнтеролог.

В этом тексте врачи назвали 6 признаков пищевой зависимости и рассказали, какие ошибки люди допускают, когда хотят наесться. А мы составили небольшой тест, который поможет понять, есть ли у вас нездоровая зависимость от еды.

https://59.ru/text/food/2023/05/18/72313463/?utm_source=vk&utm_medium=social&utm_campaign=59",Наука и техника,0.55628496
1255474,1684408393,"Почти год назад в Красноярске толпа из 11 парней жестоко избила двоих прохожих. Один из потерпевших, Семен, тогда чудом не погиб. Мужчина перенес ряд операций на мозге, получил инвалидность и буквально учится жить заново.

А 10 из 11 участников избиения почему-то проходят по делу лишь свидетелями. Подозреваемым признали только одного, но даже его уже год не могут задержать. Семья пострадавшего пытается добиться справедливости, но пока ничего не выходит.

Подробности этой истории — в материале наших коллег.

https://59.ru/text/incidents/2023/05/18/72312836/?utm_source=vk&utm_medium=social&utm_campaign=59",Силовые структуры,0.57992446
1255472,1684408265,"Помните, мы рассказывали о том, что над двором жилого дома на Монастырской, 46 работает кран с соседней стройки? 
 
Жильцы дома были возмущены тем, что оборудование работает прямо над детской площадкой, но застройщик утверждал, что это не так: якобы башенный кран оснащен специальным устройством, которое не позволяет перемещать грузы в опасных зонах. 
 
После жалоб, на место выезжали надзорные ведомства, но после их приезда площадку и вовсе закрыли. 
 
👍 Похоже, что конфликт всё-таки разрешился: сегодня жильцы и застройщик — ООО «СЗ Камские огни» — подпишут мировое соглашение. Компания построит новую детскую площадку в безопасном месте — для этого она предоставит часть своего участка.",Город,0.9050273
1255461,1684406363,"Пермяки, полакомиться кофе с грудным молоком в «Кофе Смайл», похоже, не получится! 💁‍♀

Вчера мы написали о пермской кофейне, в которой начали продавать кофе с грудным молоком. В тот же день на владельцев кофейни взъелся Роспотребнадзор — в итоге все назвали шуткой. 
 
Хозяин кафе объяснил, что вкус грудного молока они имитировали путем смешивания козьего и миндального. А шутка родилась, когда они отдыхали с друзьями. 
 
— Одна из наших подруг, молодая мамочка, говорит: «Мне нужно отлучиться, потому что у меня переизбыток молока и нужно его сцедить». Мы пошутили всей компанией, и тогда я предложил жене снять такую классную штуку [видео]. На той неделе начали делать съемки, чтобы потом выложить материал в сетях. Кто-то мимо проходящий на Крохалях сфоткал наш плакат для съемок — и всё полетело. — рассказал нам владелец кафе Максим Кобелев. 
 
Максим еще раз подчеркнул, что хотел снять художественный клип-шутку, а не рекламный. 
 
— Всё так разлетелось, а я просто продолжил подыгрывать, но что-то вышло из-под контроля, — говорит мужчина. 
 
Слова про 650 рублей за 350 миллилитров напитка тоже были элементом шутки. В действительности кофе со смесью миндального и козьего молока в его кофейнях обойдется в 250 рублей.",Культура,0.48708302
1255446,1684404506,"Вчера в Перми прошло открытие первого Форума гостеприимства России.
 
По словам организаторов, там собрались более тысячи человек с разных регионов страны. 
 
Организаторы этого форума проводят конкурс «Мастера гостеприимства», цель которого, по их словам, «вывести туризм в России на новый уровень». 
 
Проходит всё это дело при поддержке властей. 
 
Посмотрите фоточки с открытия, там даже DS Crew танцевали!",Культура,0.55703807
1255422,1684400454,"У нас для вас тест на внимательность!

Задача очень простая: нужно найти на картинке с лесом ежа. Говорят, это просто невозможно сделать меньше чем за 45 секунд, но у вас есть шанс доказать обратное.

Если готовы, переходите на сайт. И не забудьте написать в комментарии, за сколько вы справились с задачей.

https://59.ru/text/entertainment/2023/05/18/72313649/?utm_source=vk&utm_medium=social&utm_campaign=59",Наука и техника,0.9400354
1255413,1684399885,"Со здания бывшего клуба МВД на Сибирской убрали леса. Смотрите, как его отреставрировали! 
 
Работы начали осенью прошлого года. Здание является памятником культуры федерального значения, поэтому на согласование проекта реставрации ушло время. До революции здесь располагался Дворянский клуб и бывал Антон Чехов. 
 
Проектировщики вернули портикам здания решетку, воссозданную по фотографиям и историческим чертежам — такая же украшала здание изначально. 
 
Сейчас власти обсуждают, что будет в этом здании после ремонта. Из последних идей, озвученных властями — разместить в здании дом приемов и ЗАГС Ленинского района Перми. 
 
Как вам, подписчики?",Город,0.38309085
1255400,1684398582,"Глава СК РФ Бастрыкин заинтересовался делом о домах для сирот в Прикамье 
 
📌В 2013–2014 годах в селе Уинское ООО «Партнер» построило шесть многоквартирных домов. Минстрой выкупил у компании эти дома за 11,3 миллиона рублей и передал детям-сиротам. 
 
Но 2016 году там обнаружили нарушения при строительстве, после чего суд обязал ООО «Партнер» вернуть в бюджет полученные от Минстроя деньги. Но до настоящего момента деньги в полном объеме не поступили. Об этом накануне напомнили активисты «Народного фронта» в своих соцсетях. 
 
🔴 Сегодня, спустя почти 10 лет, Александр Бастрыкин запросил доклад по ситуации, а также о проделанной работе по восстановлению прав сирот и предоставлению им благоустроенного жилья.",Город,0.5621294
1255392,1684397449,"Полина Пьянкова узнала, что у нее рак, когда училась в седьмом классе. У девушки получилось победить страшную болезнь, и теперь Полина учится на врача, чтобы спасать жизни.

О том, как в один миг у девочки рухнул весь мир и как она боролась с болезнью, Полина рассказала нашим коллегам.

https://59.ru/text/health/2023/05/18/72312920/?utm_source=vk&utm_medium=social&utm_campaign=59",Наука и техника,0.7496442
1255391,1684397256,"На спецоперации погиб уроженец Соликамска Антон Куклин. 
 
По данным администрации Березников, Антон родился 29 апреля 1985 года. Детство и юность провел в Соликамске. В 2001 году он окончил училище № 40 в Березниках, получил профессию столяра-станочника. С 2003-го по 2005 год он проходил военную службу по призыву. 
 
— Показал себя дисциплинированным, ответственным военнослужащим, готовым выполнять самые сложные задачи, — уточняют в администрации города. 
 
Антон Куклин работал в Березниках в строительно-монтажном тресте «Химмашсервис». При каких обстоятельствах он попал на СВО, не уточняется. 
 
Мужчину посмертно наградили орденом Мужества.",Силовые структуры,0.6201234
1255388,1684396971,"❗️В Крыму из-за взрыва сошли с рельсов вагоны с зерном. Движение поездов между Симферополем и Севастополем приостановлено. 
 
В телеграм-канале Крымской железной дороги сообщили, что это произошло из-за «вмешательства посторонних лиц в работу железнодорожного транспорта». Другие телеграм-каналы (Baza, Mash, SHOT) говорят о том, что на железной дороге произошёл взрыв. 
 
Глава Крыма Сергей Аксёнов рассказал, что пострадавших нет, а о причинах ЧП заключение даст УФСБ. 
 
Фото: Baza / Telegram",Силовые структуры,0.3810983
1255386,1684396804,"Волонтеры, которые оказывают помощь пермским участникам СВО, а также их семьям обратились в администрацию Перми.

Общественная организация «Молот» нуждалась в помещении для продолжения работы. Городские власти оперативно решили данный вопрос и подобрали несколько вариантов. 
 https://59.ru/text/gorod/2023/05/18/72314342/

Открытая трибуна",Город,0.86438996
