,date,text,topic,topic_proba
1255803,1684495365,"Бывшему мэру Екатеринбурга Евгению Ройзману* сегодня вынесли приговор за дискредитацию Вооруженных сил РФ: суд назначил политику штраф в размере 280 тысяч рублей, но с учетом задержания итоговую сумму снизили до 260 тысяч. Это ровно столько, сколько запросила прокуратура.

Это первое уголовное дело против Евгения Ройзмана*, которое дошло до приговора (судимость, которую он получил в 1980 году, снята).

Вспоминаем, как оно развивалось  — от обыска до вердикта.

* Евгений Ройзман признан иноагентом в РФ.

https://59.ru/text/politics/2023/05/19/72319226/?utm_source=vk&utm_medium=social&utm_campaign=59",Силовые структуры,0.5176732
1255801,1684494484,"Пермяки, вот вам идея, чем занять ребенка с 1 по 4 июня: в Перми пройдет фестиваль детского кино «Медвежонок» (6+).

События будут происходить в кинотеатрах и даже на городской эспланаде. Всего покажут около 40 фильмов для разных возрастов. На фестивале ждут много кинозвезд.
 
Рассказываем, какие фильмы можно на нем посмотреть и где всё это будет происходить.

https://59.ru/text/culture/2023/05/19/72318662/?utm_source=vk&utm_medium=social&utm_campaign=59",Культура,0.78767616
1255779,1684492450,"Худеете к лету? Или хоть раз худели по какому-нибудь случаю? Например, ко дню рождения или к другому празднику. Обычно сезонные попытки похудеть заканчиваются не тем результатом, которого ожидаешь.

Похудение — это непростой процесс, если говорить про качественное снижение веса и сохранение здоровья.

Что же не так с популярными диетами и как сбросить вес раз и навсегда — рассказала нутрициолог в этом материале.

https://59.ru/text/health/2023/05/19/72316742/?utm_source=vk&utm_medium=social&utm_campaign=59",Наука и техника,0.53018737
1255773,1684492209,"Сегодня ФСБ провела серию обысков у известных пермских общественников. Это было связано с уголовным делом против двух бывших сотрудников Пермского «Мемориала»* Роберта Латыпова и Александра Чернышова: их обвиняют в покушении на контрабанду культурных ценностей — архивов «Мемориала»*.

🔴Мы связались с Робертом Латыповым. Он объяснил, о каких документах идет речь, куда их везли и почему. 

*организация ликвидирована в 2022 году, входила в структуру международного «Мемориала», признанного иностранным агентом и тоже ликвидированного

https://59.ru/text/gorod/2023/05/19/72318836/?utm_source=vk&utm_medium=social&utm_campaign=59",Силовые структуры,0.5104246
1255764,1684491485,"Евгению Ройзману* вынесли приговор за дискредитацию Вооруженных Сил РФ. 
 
Экс-мэра Екатеринбурга оштрафовали на 260 тысяч рублей (снова). Ранее политика уже штрафовали, но на этот раз ему предъявили уголовное обвинение. 
 
📌 Ройзмана* задержали 16 марта и сразу доставили в отдел полиции, а потом в суд. За него вступились Алла Пугачева, вдова первого президента России Наина Ельцина, драматург Николай Коляда и многие другие известные деятели. 
 
* Евгений Ройзман признан иноагентом в РФ.",Силовые структуры,0.34834805
1255761,1684491306,"Пара из Перми прямо под камерами украла забытый на банкомате кошелек с деньгами и картами. 
 
Житель Перми Сергей Горячев 5 мая снимал наличку в гостинице «Урал» и забыл портмоне на банкомате. Когда он вернулся за вещами — их уже и след простыл. Сумма денег в кошельке была значительной. 
 
На записи с камеры видно, что пара зрелого возраста, недолго мешкая, прихватила кошелек, сунула его в пакет и быстро скрылась. Причем, мужчина в процессе на несколько секунд обернулся и посмотрел лицом прямо в объектив 🙃 
 
▶ Впрочем, смотрите сами кадры этого ограбления века: может узнаете воришек. 
 
Если вы знаете пару на видео — напишите нам в сообщениях. Также мужчина предлагает людям, укравшим кошелек, вернуть его вместе с содержимым и обещает, что в таком случае не будет иметь к ним претензий. 
 
По словам Сергея, полиция сейчас проводит проверку по его заявлению. 
 
А еще распространите информацию!",Экономика,0.57679385
1255746,1684488533,"Анастасия Бородина превратила увлечение в успешный бизнес, когда открыла свою студию танцев. Но внезапно оставила карьеру, когда после отпуска решила не возвращаться из Турции.

Наши коллеги поговорили с Анастасией о том, как она адаптировалась к жизни на курорте, с какими сложностями столкнулась и как пытается получить ВНЖ.

https://59.ru/text/world/2023/05/19/72316997/?utm_source=vk&utm_medium=social&utm_campaign=59",Культура,0.5331211
1255741,1684488042,"Пермяки, забросьте зонтики подальше: в выходные будет сухо и тепло!🌞 
▪Суббота: малооблачно, без дождей. 
По краю: ночью до +4... +9 °C, днем до +20... +25 °C. 
В Перми: ночью +7... +9 °C , днем +22... +24 °C . 
 
▪Воскресенье: осадков не будет, ветер слабый переменного направления. 
В крае ночью +4... +9 °C, днем до +21... +26 °C. 
В Перми ночью до +7... +9 °C, днем до +23... +25 °C. 
 
Отправьте этот прогноз десяти друзьям, чтобы он сбылся!😉",Город,0.9409884
1255731,1684486806,"В своем телеграм-канале Алексей Демкин рассказал, что в торговых центрах появится пространство для подростков. Идею уже поддержали руководители ТЦ. 
 
Глава Перми отметил, что подобные площадки станут еще одной возможностью проведения полезного досуга для пермской молодежи.
https://59.ru/text/gorod/2023/05/19/72318092/ 

Открытая трибуна",Город,0.5706481
1255706,1684484818,"Игорь Сапко взял на контроль ситуацию с обысками у пермских общественников и правозащитников 
 
— Обеспокоен и держу руку на пульсе, — прокомментировал омбудсмен Прикамья. — Пообщался по телефону с Татьяной Ивановной, договорились информировать друг друга по текущей ситуации. Все пермские активисты-общественники, по имеющейся информации на данный момент, являются свидетелями. 
 
Также он добавил, что в связи с задержанием Пермского общественника Александра Чернышова в Москве на прошлой неделе направил прокурору Московской области запрос о проведении проверки соблюдения его прав. 
 
— Переговорил с представителями силовых структур, участвующих в следственных действиях, попросил обратить особое внимание на чёткое соблюдение действующего законодательства в данном конкретном деле, — заявил омбудсмен. 

📌 5 мая в аэропорту Шереметьево Александра Чернышова задержали и приговорили к 15 суткам ареста за хулиганство. Сегодня, 19 мая, стало известно об обысках у пермских общественников и правозащитников: двух членов Совета по правам человека при президенте РФ — Светланы Маковецкой (возглавляет центр ГРАНИ) и Татьяны Марголиной (бывшего омбудсмена Прикамья), журналисток Татьяны Черепановой и Оксаны Асауленко (также является экс-членом краевой общественной наблюдательной комиссии по правам осужденных).

В ФСБ объяснили, что обыски связаны с уголовным делом по статье «Покушение на контрабанду культурных ценностей» в отношении Александра Чернышова и Роберта Латыпова.",Силовые структуры,0.9331904
1255695,1684483880,"⚡ФСБ объяснила обыски у пермских общественников уголовным делом о покушении на контрабанду культурных ценностей 
 
По данным ведомства, экс-руководитель пермского краевого отделения «Мемориала»* Роберт Латыпов, и председатель «Центра исторической памяти» Александр Чернышов пытались вывезти из России в Германию архивные документы «Мемориала»*. На мужчин завели уголовное дело «Покушение на контрабанду культурных ценностей». 
 
ФСБ указывает, что, согласно экспертизе, эти документы имеют культурную и историческую ценность. 
 
Сейчас полиция и ФСБ устанавливают все обстоятельства дела. 
 
*ликвидировано в 2022 году, входило в структуру международного «Мемориала», признанного иностранным агентом и тоже ликвидированного

📌 Ранее мы писали, что 19 мая обыски прошли у двух членов Совета по правам человека при президенте РФ — Светланы Маковецкой (руководитель центра ГРАНИ) и Татьяны Марголиной (экс-омбудсмена Пермского края), а также у журналиста Татьяны Черепановой и журналистки, экс-члена краевой общественной наблюдательной комиссии по правам осужденных Оксаны Асауленко. Мы выяснили, что Татьяна Марголина и Светлана Маковецкая проходят свидетелями по делу об архиве «Мемориала».",Силовые структуры,0.465988
1255689,1684483203,"Весной во дворах из-под снега вытаивают горы мусора, облезлые бордюры и сломанные качели. Жильцы, конечно же, хотят, чтобы всё прибрали как можно скорее. А сколько на самом деле у коммунальщиков есть времени на весеннюю уборку, кто решает, что именно будут ремонтировать и за чей счет проводят дополнительные работы — например, обработку от клещей?

Своим опытом поделились специалисты управляющей компании «ЮКОМ». https://59.ru/text/house/2023/05/19/72312716/

Реклама
ООО «УК «ЮКОМ»
https://59.ru/?erid=Kra23wZMK",Город,0.49345955
1255684,1684482781,"Пермяки, ура! В День празднования 300-летия Перми мы с вами сможем ездить на общественном транспорте бесплатно. 
 
При этом работать транспорт будет дольше обычного. 
 
По словам главы города Алексея Дёмкина, бесплатным проезд будет весь день: с самых первых рейсов 12 июня и до 2 часов ночи.",Город,0.96007276
1255679,1684481906,"Власти определились, кто отремонтирует около 102 километров автодорог в Прикамье: завершились торги по двум лотам на общую сумму почти в 2 миллиарда рублей. 

По обеим закупкам поступали жалобы антимонопольщикам на то, что размещение таких объемных лотов нарушает права небольших компаний, которые могли бы взяться за ремонт отдельных участков. Но жалобы признали необоснованными и конкурс состоялся.

В итоге в торгах по двум лотам победила одна компания — АО «Уралмостострой». 

Рассказываем подробнее о закупках, подрядчике и о том, какие дороги ему предстоит отремонтировать.

https://59.ru/text/transport/2023/05/19/72318089/?utm_source=vk&utm_medium=social&utm_campaign=59",Экономика,0.685933
1255661,1684480055,"Внезапно сменить сферу деятельности кажется чем-то нереальным. Но герой нашего материала решил рискнуть. 
 
Иван работал в финансовой сфере, построил классную карьеру, но попал под сокращение. Тогда он понял — надо что-то менять, в финансы возвращаться не хочется. Друг позвал в Контур. 
 
О том, как пермяк без опыта попал на работу к федеральному IT-разработчику и стал там руководителем — по ссылке: https://59.ru/text/gorod/2023/05/19/72305309/ 
 
Реклама 
АО «ПРОИЗВОДСТВЕННАЯ ФИРМА «СКБ КОНТУР» 
https://59.ru/?erid=Kra23Xi5o",Экономика,0.96647406
1255659,1684479831,"В Перми мужчину осудили за убийство магазинного вора, совершенное 20 лет назад 
 
📌 В 2002 году в одном из магазинов в Индустриальном районе Перми 18-летний грузчик увидел, как пьяный местный житель пытается украсть алюминиевую флягу из магазина и ударил его по голове поленом. От этого грабитель умер на месте. 
 
Уроженца Таджикистана, который нелегально проживал в России, объявили в федеральный розыск. Все это время убийца переезжал с места на место и сменил имя и фамилию. В 2022 году его поймали при попытке пересечь границу. То, что это именно разыскиваемый, выяснили по отпечаткам пальцев на полене. 
 
🔴 Суд приговорил виновного к 8 годам и 6 месяцам колонии строгого режима.",Силовые структуры,0.7459629
1255648,1684477560,"«Пробыл три года в плену на войне в Сирии. Делюсь полезным и вдохновляющим опытом».

Такой статус в социальной сети стоит в профиле у Константина. В 27 лет мужчина решил исполнить мечту и отправился в путешествие. Но в Сирии, через которую он ехал до Сахары, его посчитали шпионом: мужчина несколько лет провел в тюрьме, рисовал на стенах камеры и учил арабский по детской книге.

И это — не первый случай, когда россияне отправлялись за границу и пропадали. Жуткие истории наши коллеги собрали в этом материале.

https://59.ru/text/criminal/2023/05/19/72317261/?utm_source=vk&utm_medium=social&utm_campaign=59",Силовые структуры,0.50154036
1255636,1684475926,"❗️Сегодня, 19 мая, ФСБ провела обыски у известных пермских активистов и общественников по делу об архиве «Мемориала»* 
 
Обыски проходят дома у двух членов Совета по правам человека при президенте РФ — Светланы Маковецкой и Татьяны Марголиной, а также у журналиста Татьяны Черепановой и журналистки, экс-члена краевой общественной наблюдательной комиссии по правам осужденных Оксаны Асауленко. 
 
— Насколько я поняла, я являюсь свидетелем в уголовном деле о вывозе архивов «Мемориала», которое возбудили в отношении бывших сотрудников «Мемориала». Их провели сотрудники ФСБ на основании решения суда, — рассказала экс-омбудсмен в Пермском крае и действующий член СПЧ при президенте Татьяна Марголина. — Скорее всего, обыски проходили в рамках следственных действий. 
 
Собеседница добавила, что сейчас не отвечают телефоны члена краевой Общественной палаты Надежды Агишевой и члена правления пермского Мемориала Веры Седининой. 
 
Муж главы центра ГРАНИ Светланы Маковецкой, бывший глава Пермской гражданской палаты Игорь Аверкиев сообщил, что его супруга является свидетелем по уголовному делу о вывозе архива «Мемориала», которое возбудили в отношении экс-председателя пермского «Мемориала» Роберта Латыпова и председателя пермского Центра исторической памяти Александра Чернышова. 
 
*ликвидировано в 2022 году входило в структуру международного «Мемориала», признанного иностранным агентом и тоже ликвидированного.",Силовые структуры,0.49000692
1255630,1684474366,"На днях Владимир Путин подписал указ об изменениях в системе высшего образования. Теперь вместо бакалавриата в вузах постепенно будут появляться базовый и специализированный уровни.

Кроме этого, с марта вступили в силу и другие изменения, они касаются правил приема в вузы.

В этом материале рассказываем о нововведениях, к которым нужно готовиться абитуриентам в этом году.

https://59.ru/text/education/2023/05/19/72315998/?utm_source=vk&utm_medium=social&utm_campaign=59",Экономика,0.5941591
1255623,1684473729,"Вчера вечером, 18 мая, в Перми на площади Карла Маркса загорелся автомобиль Lexus. 
 
Наш читатель прислал фото происшествия. 
 
В МЧС сказали, что происшествие квалифицируется как ДТП — автомобиль загорелся во время движения. В городском ГИБДД нам сообщили, что информации об этом нет.",Силовые структуры,0.53362024
1255619,1684473367,"Городская администрация через суд выселяет из единственного жилья семью боевого офицера, награжденного орденом Мужества. Пока Олег в зоне СВО, в Екатеринбурге его жена ходит по судам, чтобы не остаться на улице с двухлетней дочкой.

Нет, у семьи нет никаких ипотечных долгов, в квартире они жили по договору служебного найма. А сейчас чиновники заявляют, что дали эту квартиру по ошибке, и требуют выселения.

Подробности истории — в материале наших коллег.

https://59.ru/text/family/2023/05/19/72316910/?utm_source=vk&utm_medium=social&utm_campaign=59",Силовые структуры,0.5341988
1255617,1684473028,"Сразу в нескольких регионах России ввели очередной карантин: на этот раз во всем виноват птичий грипп. Его выявили у диких птиц, для них вирус очень опасен. Впрочем, как и для людей — заболевание протекает тяжело.

Стоит ли опасаться новой пандемии? Как обезопасить себя? Разбирались вместе с врачами.

https://59.ru/text/health/2023/05/19/72317408/?utm_source=vk&utm_medium=social&utm_campaign=59",Наука и техника,0.62862796
