,date,text,topic,topic_proba
1256272,1684672440,"Подписчики отправляют фото весенней природы нашего края, а мы делимся с вами! 
 
Красотища, правда? 
 
Знаем, что у вас тоже есть классные снимки 😎 Не стесняйтесь отправлять их в комментах!",Культура,0.7304134
1256265,1684666290,"Вопрос о том, куда поехать в отпуск, второе лето подряд занимает головы наших соотечественников. Анапа, кажется, будет забита под завязку, как и Санкт-Петербург, а дача с картошкой успевают надоесть еще в мае. 

Куда можно отправиться без визы за небольшие деньги, выяснили наши коллеги. Публикуем их небольшой, но полезный гайд. 

https://59.ru/text/world/2023/05/21/72320072/?utm_source=vk&utm_medium=social&utm_campaign=59",Экономика,0.6855144
1256263,1684665971,"Летом на берегу Камы устроят двухдневный музыкальный фестиваль. Хедлайнером будет Найк Борзов. Помимо выступлений музыкантов на фестивале будут проводить соревнования и мастер-классы по экстремальным видам спорта. Рассказываем подробнее. 

https://59.ru/text/gorod/2023/05/21/72323879/?utm_source=vk&utm_medium=social&utm_campaign=59",Культура,0.32868844
1256261,1684665612,"Мы продолжаем задавать неловкие вопросы врачам. В этом выпуске мы разбираемся в бесконечном голоде, вздутии и газах, во вреде откладывания похода в туалет по-большому и в глистах в головном мозге. На все вопросы, которые вы стеснялись задать на приеме, 59.RU ответил гастроэнтеролог Александр Соболь.

https://59.ru/text/health/2023/05/21/72319613/?utm_source=vk&utm_medium=social&utm_campaign=59",Экономика,0.72527224
1256257,1684665414,"Все овощи уже рассажены на свои законные места, а свободная грядка всё-таки осталась? Дорогие дачники, у нас есть для вас идея: заполните пустоту полезными и пряными травами. 

Они не отнимут у вас много времени и сил, зато потом окажутся очень кстати. Что посадить в аптекарском огороде — рассказываем по ссылке. 

https://59.ru/text/spring/2023/05/21/72305861/?utm_source=vk&utm_medium=social&utm_campaign=59",Наука и техника,0.9825979
1256255,1684665261,"Одна из насущных проблем россиян — цены растут, а зарплаты за ними не поспевают. Поэтому многим приходится искать подработку на вечер или выходные. 

Вот и наша коллега решила улучшить свое материальное положение и начала искать, где можно немного подзаработать. 

О том, почему собирание букетиков из ковыля, опросы по телефону и расклейка объявлений — не самые перспективные варианты, журналистка рассказала в своей авторской колонке.

https://59.ru/text/job/2023/05/21/72319139/?utm_source=vk&utm_medium=social&utm_campaign=59",Экономика,0.5144746
1256229,1684658058,"В руки нашего автоэксперта попала очередная китайская машина. Но в этот раз отзывом на него поделится не только опытный тестировщик, но и его семья, которая не очень-то жалует автомобили из Поднебесной. 

Как изменились китайские марки за минувшие 15 лет и чего ждать от Chery Tiggo 8 Pro — читайте в подробном обзоре.

https://59.ru/text/auto/2023/05/21/72305954/?utm_source=vk&utm_medium=social&utm_campaign=59",Наука и техника,0.35069788
1256228,1684657909,"20 мая руководитель ЧВК «Вагнер» Евгений Пригожин заявил о том, что был взят город Бахмут (Артемовск). Операция заняла 224 дня. Информацию подтвердили в Минобороны России, а президент Владимир Путин поздравил ВС РФ и ЧВК «Вагнер» со взятием города. Рассказываем подробно обо всём, что известно об этом событии.

https://59.ru/text/world/2023/05/21/72323771/?utm_source=vk&utm_medium=social&utm_campaign=59",Силовые структуры,0.27759168
1256224,1684657592,"У юристки Елены Першаковой провели дома обыск. При этом, сообщается, что за ней пришли к ее подруге, а оттуда уже отправились в квартиру Елены. Как рассказали ее коллеги, обыск связан с пермским «Мемориалом»*.

* Организация ликвидирована в 2022 году, входила в структуру международного «Мемориала», признанного иностранным агентом и тоже ликвидированного.

https://59.ru/text/gorod/2023/05/21/72323726/?utm_source=vk&utm_medium=social&utm_campaign=59",Силовые структуры,0.56953996
1256215,1684650859,"Отечественные кинематографисты решили быть в тренде и представили зрителю еще одну версию Холмса и Ватсона — Станиславского и Гиляровского. 

В новом фильме Шахназарова «Хитровка. Знак четырех» герои Константина Крюкова и Михаила Пореченкова расследуют убийство. 

Удалось ли режиссеру создать атмосферу настоящего детектива, а зрителям — поверить в Станиславского? Читайте в рецензии наших коллег.

https://59.ru/text/entertainment/2023/05/21/72320171/?utm_source=vk&utm_medium=social&utm_campaign=59",Культура,0.51773715
1256214,1684650773,"Постоянное чувство голода и перекусы мы обычно связываем только с отсутствием силы воли и зависимостью от сладкого и булочек. Но голод может быть симптомом серьезных заболеваний, среди которых рак поджелудочной железы и язвы.

Почитайте, что может скрываться за неожиданно возросшим аппетитом или за тягой к сладкому. Об этом нам рассказали врачи-гастроэнтерологи.

https://59.ru/text/health/2023/05/21/72322802/?utm_source=vk&utm_medium=social&utm_campaign=59",Экономика,0.46036392
1256213,1684650668,"ФСБ возбудила уголовное дело за госизмену на двоих жителей Пермского края. Ранее их заочно осудили за поджог пермского штаба «Единой России» и нанесение лозунгов на здание краевой прокуратуры. По данным следствия, в 2022 году они отправились воевать на стороне Украины.

https://59.ru/text/world/2023/05/21/72323669/?utm_source=vk&utm_medium=social&utm_campaign=59",Силовые структуры,0.84213847
1256207,1684645909,"Когда в доме появляется котик, перед хозяевами встает непростой вопрос — а чем нового друга лучше кормить? 

От количества кормов в магазине разбегаются глаза, а взгляд, который усатый бросает на котлетку, вызывает острое желание поделиться с ним собственным завтраком, обедом и ужином. 

В поисках ответов мы обратились к рейтингам от экспертов Роскачества. И обнаружили там совсем не то, что ожидали. Подробности — в материале наших коллег.

https://59.ru/text/animals/2023/05/21/72319472/?utm_source=vk&utm_medium=social&utm_campaign=59",Наука и техника,0.5679751
1256205,1684642880,"Когда в Пермь приезжают гости, многое кажется им странным. Вроде того, что мосты называют дамбами, улицу Тихим Компросом, а здание на Комсомольской площади «Башней смерти». Мы собрали вопросы, которые задавали нам друзья и знакомые из других регионов и подготовили на них ответы. Держите, делитесь с друзьями. И рассказывайте в комментариях, что спрашивают у вас туристы.

https://59.ru/text/gorod/2023/05/21/72278600/?utm_source=vk&utm_medium=social&utm_campaign=59",Культура,0.33751264
1256203,1684642562,"Пригожин заявил о взятии Бахмута, мэр Краснодара поручил проверить все караоке-клубы города из-за песни Верки Сердючки, парня 2005 года рождения на Украине приговорили к десяти годам лишения свободы за помощь российским военным. Главные новости вокруг спецоперации за последние сутки.

https://59.ru/text/world/2023/05/20/72323477/?utm_source=vk&utm_medium=social&utm_campaign=59",Культура,0.40931696
1256171,1684605556,"Ровно 44 года назад Пермь стала городом-миллионником. 20 мая 1979 года число жителей впервые превысило 1 миллион человек. 
 
Газета «Вечерняя Пермь» объявила, что 20 мая родились миллионные жители Перми. Ими признали сразу трех младенцев: Алешу Алалыкина, Васю Маланухина и Любу Пономареву. 
 
Только публикацией в газете не ограничились — 1 июня в ДК Свердлова (сегодня это ДК имени Солдатова) прошла торжественная регистрация рождения миллионных малышей. А семьи Алалыкиных, Маланухиных и Пономаревых вне очереди получили от города по квартире. 
 
Фото: Государственный архив Пермского края и архив города Перми",Город,0.54875374
1256158,1684601280,"Пермь на рубеже XIX-XX веков. 
 
Подписчики, какие места узнали? Пишите в комментах! 
 
Фото: Perm-de-Monocle / Вконтакте",Культура,0.5737452
1256157,1684600440,"Как только приходит время записаться в спортзал, на глаза сразу же попадаются различные продукты с непонятными названиями: протеины, гейнеры, БЦАА и БАДы. 

Но полезны ли они? Можно ли заменить протеиновым коктейлем полноценный прием пищи? Влияют ли эти добавки на гормоны? А состав — натуральный или сплошная химия? 

Эти вопросы мы задали кемеровскому бодибилдеру Станиславу Рыбникову. Его ответы собрали в коротком видео.",Спорт,0.70961374
1256122,1684584986,"Мода бывает жестока. Особенно к нашему кошельку: меняется стремительно, и то, что было в тренде еще пару лет назад, в этом сезоне можно смело прятать на самую дальнюю полку в шкафу. 

Собрали в одном материале сразу 11 (!) антитрендов, которые точно не помогут выглядеть стильно. Сохраняйте этот материал и отправляйтесь на ревизию летних вещей! 

https://59.ru/text/style/2023/05/20/72318410/?utm_source=vk&utm_medium=social&utm_campaign=59",Наука и техника,0.47925472
1256121,1684584887,"В Перми перенесли остановку «Улица Космонавта Леонова». С 20 мая автобусы останавливаются на шоссе Космонавтов после перекрёстка с улицей Космонавта Леонова в направлении центра.

Здесь тормозят автобусы, №29, №62, а теперь еще и маршрут №10.",Город,0.9120208
1256113,1684581896,"Лучше поздно, чем никогда — так точно можно сказать про Юрия Никулина, который попал в большое кино только в 36 лет. Но даром годы не прошли: он стал любимцем публики и настоящей звездой советских фильмов. 

Сегодня вспоминаем его роли в небольшом тесте — всего 10 вопросов для настоящих знатоков отечественного кино! 

https://59.ru/text/entertainment/2023/05/20/72321428/?utm_source=vk&utm_medium=social&utm_campaign=59",Культура,0.4496132
1256103,1684578840,"Задумывались ли вы, куда попадают лошади, которые уже не могут так резво скакать, выполняя свою работу? 

«Списанных» коней к себе в Дивногорск забирает Татьяна. И свой век они доживают в покое, сытыми и ухоженными, хотя попадают в своеобразный пансионат с многочисленными травмами от предыдущих хозяев. 

О жизни «пенсионеров», которые всё еще любят морковку и сахарок, рассказываем в этом видео.",Культура,0.49615055
1256102,1684578134,"Актриса Катерина Шпица специально прилетела в Пермь, чтобы поддержать детей с особенностями развития – участников фестиваля «Полет без границ». По их рисункам создали компьютерную игру.

https://59.ru/text/education/2023/05/20/72322031/?utm_source=vk&utm_medium=social&utm_campaign=59",Культура,0.6887661
1256101,1684577746,"Наш журналист нашел в поселке Уральский панно работы Праски Витти. Это псевдоним чувашского художника Виталия Петрова, работавшего в Перми в 60-х — начале 70-х годов.

Изучаем работу и рассказываем о других — сейчас они почти не сохранились

https://59.ru/text/culture/2023/05/20/72317909/?utm_source=vk&utm_medium=social&utm_campaign=59",Культура,0.9879702
1256095,1684575790,"В Перми определили подрядчика, который будет строить детский реабилитационный центр в Камской долине на улице Маршала Жукова, 39.

Победитель — ООО «Рекон Строй». Цена контракта: 1,01 миллиарда рублей.

Центр разделят на несколько зон по функционалу. Он рассчитан на 80 мест для круглосуточного пребывания и 75 посещений дневного пребывания. Планируется, что в реабилитационном центре будут помогать детям разного возраста.

— На участке планируется создать безбарьерную среду, игровые площадки для детей по возрастам и для занятий игровыми видами спорта, стрельбы из лука, силовых адаптивных тренажеров и прогулочную зону, — рассказывают в министерстве строительства.",Город,0.44143844
1256094,1684574823,"Депобр обратился в прокуратуру из-за сообщества во «ВКонтакте», которое носит имя пермской школы № 12. Судя по всему создатели ее давно забросили, и там появилась информация, которую посчитали экстремистской.

https://59.ru/text/gorod/2023/05/20/72322556/?utm_source=vk&utm_medium=social&utm_campaign=59",Культура,0.6192373
1256090,1684574283,"Чем теплее становится на улице, тем больше живности появляется в вашем огороде. И речь не о милых визитерах из леса, а о насекомых, которые норовят испортить саженцы и лишить урожая. 

В этом материале рассказываем, как избавиться от муравьев, растаскивающих по грядкам тлю и семена сорняков. Спойлер: расскажем про способы без химии и серьезных затрат! 

https://59.ru/text/spring/2023/05/20/72305780/?utm_source=vk&utm_medium=social&utm_campaign=59",Наука и техника,0.9813256
1256079,1684573425,"«Кубинцы, использующие раритеты как личные авто, больше любят советские “жигули”. Для них есть достаточно запчастей, а часть деталей двигателя и подвески относительно легко можно изготовить самостоятельно».  

О Кубе многие знают еще по советскому прошлому. Но если у нас с построением социализма не всё пошло по плану, то там до сих пор талоны и очереди в магазинах. А еще — своя школа живописи, жертвоприношения и раритетные авто.

Фотограф Станислав Белоглазов был в республике пять раз, поэтому точно знает, куда надо и не надо ходить. Своими впечатлениями и рекомендациями он поделился с нашими коллегами — публикуем его рассказ и атмосферные фотографии. 

https://59.ru/text/world/2023/05/20/72319970/?utm_source=vk&utm_medium=social&utm_campaign=59",Наука и техника,0.9882365
1256066,1684570583,"Сочи — это море, горы и природа. А еще — место, в котором вас легко могут обмануть с жильем: не построить дом, продать несуществующие квартиры.

В неприятную историю попали жители двух высоток. Одну из них не поставили на кадастровый учет вовремя, поэтому люди не могут получить прописку в купленных квартирах. А во второй права собственников администрация города решила обжаловать в суде. 

Как вышло, что люди могут лишиться единственного жилья, рассказываем в этом материале.

https://59.ru/text/world/2023/05/20/72321587/?utm_source=vk&utm_medium=social&utm_campaign=59",Город,0.8125499
1256065,1684570396,"Микрорайон Крохалевка известен даже тем, кто никогда не был в Перми: его не раз упоминают в сериале «Реальные пацаны». С микрорайоном Голованово ситуация другая, но каждый пермяк о нем точно слышал.

Разбираемся, как тот и другой получили свои названия.

https://59.ru/text/gorod/2023/05/20/72315026/?utm_source=vk&utm_medium=social&utm_campaign=59",Культура,0.9371294
1256062,1684569601,"Народная премия 59.RU впервые состоится уже этим летом! Одно из самых масштабных событий совпало с 300-летием столицы Прикамья, и это еще один повод сказать спасибо пермским предпринимателям. 
 
В этом обзоре вы можете посмотреть потенциальных номинантов — компании, которые каждый день задают настроение жителям, обеспечивают пермяков рабочими местами и просто делают свою малую родину лучше.
https://59.ru/text/longread/2023/04/28/72259610/",Город,0.8053427
1256047,1684566716,"США и Великобритания ввели новые санкции против России. В списки попали и пермские предприятия.

Министерство торговли США ввело санкции в отношении 71 компании за поддержку России, Армении и Киргизии. В список вошли пермский завод «Машиностроитель», ЗАО «Специальное конструкторское бюро» и «Мотовилихинские заводы».

Также «Мотовилихинские заводы» попали в санкционный список Великобритании. Всего в нем 86 физических и юридических лиц, связанных с энергетическим, металлургическим, оборонно-промышленным, транспортным и финансовым сектором.",Экономика,0.5127954
